source_id,source_name,country_or_region,scope,data_type,trust_category,access_status,patient_level_available,molecular_fields_available,treatment_outcome_available,pathway_omics_available,allowed_for_model_training,allowed_for_dashboard,allowed_for_regional_context,legal_or_terms_status,evidence_strength,local_file_or_source,notes
TCGA_LUAD_CBIOPORTAL,TCGA-LUAD via cBioPortal/DataHub,USA / TCGA,LUAD patient-level public cohort,clinical; mutations; copy number; RNA depending files,TRAINABLE_PATIENT_LEVEL,public_downloaded,True,True,False,False,True,True,True,public academic use; preserve source attribution,high for clinical/molecular cohort; not treatment-response ground truth,/content/drive/MyDrive/desktop_app/data/curated/10_clinical_patients_curated.csv,Already ingested in Notebook 10 if present in repaired tables.
CPTAC_LUAD_CBIOPORTAL,CPTAC-LUAD via cBioPortal/DataHub,USA / CPTAC,LUAD proteogenomic public cohort,clinical; mutations; proteomics/phosphoproteomics depending usable files,TRAINABLE_PATIENT_LEVEL,public_downloaded_partially,True,True,False,pending true CPTAC proteomics validation,True,True,True,public academic use; preserve source attribution,high for molecular/proteogenomic cohort; pathway proxy currently used until true phosphoproteomics integration,/content/drive/MyDrive/desktop_app/data/fused/10_global_egfr_mutant_patient_table_seed.csv,Notebook 10 includes CPTAC EGFR-mutant patients. True phosphoproteomics integration is still pending.
AACR_GENIE_PUBLIC,AACR Project GENIE public,International,real-world clinical-grade cancer genomics,clinical-grade mutations; selected clinical metadata,CONTROLLED_ACCESS_REQUIRED,manual_terms_required,yes after official access,yes after official access,limited depending release,False,False,False,False,must accept official GENIE/Synapse terms before use,very high once officially accessed,,Do not use until official access is completed. No bypassing access rules.
AACR_GENIE_BPC_NSCLC,AACR GENIE BPC NSCLC,International,real-world NSCLC clinico-genomic cohort,clinico-genomic; treatment/outcome depending package,CONTROLLED_ACCESS_REQUIRED,manual_terms_required,yes after official access,yes after official access,yes depending released tables,False,False,False,False,must accept official GENIE BPC terms before use,very high once officially accessed,,"Ideal validation source later, but blocked until terms/access."
CIVIC,CIViC Clinical Interpretation of Variants in Cancer,global knowledgebase,variant evidence knowledgebase,variant evidence; therapy; sensitivity/resistance; evidence levels,KNOWLEDGE_EVIDENCE,open_public,False,True,"evidence statements, not raw patient outcome",False,False,True,True,open knowledgebase; cite source,high when evidence item is accepted/curated and disease-specific,,"Use for traceable sensitivity/resistance evidence, not as patient rows."
CGI,Cancer Genome Interpreter,global knowledgebase/tool,oncogenicity and drug-response biomarker interpretation,driver/actionability interpretation,KNOWLEDGE_EVIDENCE,public_tool_or_manual,False,True,"biomarker interpretation, not raw patient outcome",False,False,True,True,respect CGI terms,supportive; not standalone clinical recommendation,,Use as actionability/oncogenicity support only.
DGIDB,DGIdb Drug Gene Interaction Database,global knowledgebase,drug-gene interaction support,drug-gene interactions,KNOWLEDGE_EVIDENCE,open_public,False,True,False,False,False,True,False,open resource; cite source,supportive interaction only; not clinical actionability alone,,Never use DGIdb alone to recommend therapy.
PATHWAY_PROXY_NOTEBOOK10,Mutation-derived pathway proxy from Notebook 10,derived from TCGA/CPTAC seed cohort,derived pathway activity proxy,EGFR/MET/PI3K/MAPK/mTOR proxy scores,PROXY_PENDING_VALIDATION,generated_internal,True,True,False,"proxy only, not true phosphoproteomics",False,True,False,internal derived feature; must label as proxy,low-to-moderate explanatory proxy; pending true CPTAC phosphoproteomics validation,/content/drive/MyDrive/desktop_app/data/curated/10_pathway_omics_curated_long.csv,Allowed in dashboard only if labeled clearly as mutation-derived proxy.
